{
  "capture_mode": "TRACKED_AND_UNTRACKED_CHANGES_NO_CONTENT",
  "entries": [
    {
      "kind": "REGULAR",
      "path": "README.md",
      "sha256": "22ed8b6e4c8e3cd4a9516c224fa57cb92c27f5d8b65886bd36b27dd2b9b95cdd",
      "status": "M"
    },
    {
      "kind": "REGULAR",
      "path": "beidou_core/__init__.py",
      "sha256": "90389a6cfda1db9f0091932c1a3b16eb241563b9709be5d32b525a740b29c075",
      "status": "M"
    },
    {
      "kind": "DELETED",
      "path": "beidou_core/alerts.py",
      "sha256": null,
      "status": "D"
    },
    {
      "kind": "REGULAR",
      "path": "beidou_core/engine.py",
      "sha256": "746eb67642c33ae2612f3f7e800f4e6521ffbca9f03465281b23876aa7e2eba0",
      "status": "M"
    },
    {
      "kind": "REGULAR",
      "path": "beidou_core/evidence_bridge.py",
      "sha256": "2d3f16259e6a02b9c7545b952051a91199b25b61583d91fb2c9eaef912e0dffd",
      "status": "M"
    },
    {
      "kind": "REGULAR",
      "path": "beidou_core/ports.py",
      "sha256": "2b742cc5a63a1cf2c2a4ab6b5b550a49f5d5fefcddf34705b598545916b330d4",
      "status": "M"
    },
    {
      "kind": "REGULAR",
      "path": "beidou_launcher/g7_tracker.py",
      "sha256": "deae7832a36ee765c808e48cb0fe1ed71eafecdfc5417550d8a488f070c84eb3",
      "status": "M"
    },
    {
      "kind": "REGULAR",
      "path": "beidou_launcher/models.py",
      "sha256": "68a53963cea764bbb41b0d1216b4be2acbbdb5681bef106042a11d301a3e4055",
      "status": "M"
    },
    {
      "kind": "REGULAR",
      "path": "beidou_launcher/registry.py",
      "sha256": "8254459f68622409054c5262f08f994542f3d825e213f3b57fc0c6e4cc704cf0",
      "status": "M"
    },
    {
      "kind": "REGULAR",
      "path": "beidou_launcher/runtime.py",
      "sha256": "83fa911154e0693eef5a52c96faec6e795b4310fd83cf779c40b2ccaed083e2c",
      "status": "M"
    },
    {
      "kind": "REGULAR",
      "path": "beidou_launcher/supervisor.py",
      "sha256": "db52422ca4e5c131190095e1a610b7d5bd47e36a8764538c7b2fe9c8ad64aed4",
      "status": "M"
    },
    {
      "kind": "REGULAR",
      "path": "beidou_launcher/testnet_exemptions.py",
      "sha256": "f238f3f7712317de48288a99902e032fa3bc22d2b83a38da295e873664ab5acb",
      "status": "M"
    },
    {
      "kind": "REGULAR",
      "path": "beidou_launcher/write_registry.py",
      "sha256": "fee1bff12e6d0e5a7413c7e5761db9b45d922cf3b51ca10066ec5d1ca6623dae",
      "status": "M"
    },
    {
      "kind": "REGULAR",
      "path": "beidou_observability/monitoring/__init__.py",
      "sha256": "7f910a06c72463c1932886a6e2dec4ec82a5dd49d008d62b4bd2cfb9958f382d",
      "status": "M"
    },
    {
      "kind": "REGULAR",
      "path": "beidou_observability/monitoring/contracts.py",
      "sha256": "2230452f1bbcef0cea522c482408882becd9c8d3799ade15352288c1d881a386",
      "status": "M"
    },
    {
      "kind": "REGULAR",
      "path": "beidou_observability/monitoring/frequency_policy.py",
      "sha256": "b9533c7a5a08ef2c92bdc998a084ee5e45625c6d8adb137470789541671536f4",
      "status": "M"
    },
    {
      "kind": "DELETED",
      "path": "beidou_observability/monitoring/incident_manager.py",
      "sha256": null,
      "status": "D"
    },
    {
      "kind": "REGULAR",
      "path": "beidou_observability/monitoring/repository.py",
      "sha256": "163ef9952a9ab1a4bf7e7051a59f4e419f6dde5cd0c2ec61caed61f8b611fed3",
      "status": "M"
    },
    {
      "kind": "REGULAR",
      "path": "beidou_observability/monitoring/retention.py",
      "sha256": "8722d5e3095aa168669e71e998915fb15ed2045f5bdab2fc885a21a021576418",
      "status": "M"
    },
    {
      "kind": "REGULAR",
      "path": "beidou_observability/monitoring/scheduler.py",
      "sha256": "f388e19cf2b1e27b59569c722fe7da86ea25b63ee3a3de6e53b27321f1e2f19e",
      "status": "M"
    },
    {
      "kind": "REGULAR",
      "path": "beidou_observability/monitoring/service.py",
      "sha256": "d1e2db50134841f8967ab338a9f0ef2279a5165672b5cb3798926afa792e8438",
      "status": "M"
    },
    {
      "kind": "DELETED",
      "path": "beidou_observability/monitoring/storm_detector.py",
      "sha256": null,
      "status": "D"
    },
    {
      "kind": "REGULAR",
      "path": "beidou_observability/monitoring/watchdog.py",
      "sha256": "9a1dcf3016761e834fdddf2b9653cc93cef95494f9a1ca5cc9a3bf1eb0b4840e",
      "status": "M"
    },
    {
      "kind": "REGULAR",
      "path": "beidou_observability/telemetry.py",
      "sha256": "233f9dfc0340880ecfe405b2f29c0b60f60ad95739daba7dd17c9fe877efdec8",
      "status": "M"
    },
    {
      "kind": "REGULAR",
      "path": "beidou_shared/config/__init__.py",
      "sha256": "fce82180bd9218cb045a8d6f5df3a1c6aa0783f50154b00da382ec80fba7c661",
      "status": "M"
    },
    {
      "kind": "REGULAR",
      "path": "config/env.template.yaml",
      "sha256": "a3fe01930855a3eb60fc0d5f9d4e0a1b0bad6aff38a3d9a6da1f3512e2470eba",
      "status": "M"
    },
    {
      "kind": "REGULAR",
      "path": "config/write-capability-registry.json",
      "sha256": "80dab1facfc0dd48fb5ca3239da835ebca4a14b48e7eb1732398eb868a2ac71a",
      "status": "M"
    },
    {
      "kind": "REGULAR",
      "path": "pyproject.toml",
      "sha256": "ea1cc29e6a7854117906384e2d977bd8f786c2dc79e3cee385ff4beb62518f5c",
      "status": "M"
    },
    {
      "kind": "REGULAR",
      "path": "scripts/monitor_daemon.py",
      "sha256": "552e9d3917812f68ecae1eb1b39fd1463e0e3294beea0423eb41bccd43ff2593",
      "status": "M"
    },
    {
      "kind": "REGULAR",
      "path": "tests/architecture/test_write_capability_registry.py",
      "sha256": "20fd0df74d223c3f3645f7917a2431151714835353a5cca39d6e37c679f9ea6c",
      "status": "M"
    },
    {
      "kind": "REGULAR",
      "path": "tests/architecture/test_write_registry_independent_oracle.py",
      "sha256": "060b6947b4544eef607fffe9cd0046e6e9ad304e55ced805cef4c973c0a34475",
      "status": "M"
    },
    {
      "kind": "DELETED",
      "path": "tests/unit/test_alerts.py",
      "sha256": null,
      "status": "D"
    },
    {
      "kind": "REGULAR",
      "path": "tests/unit/test_debounce_repairable_split.py",
      "sha256": "b5293846e3e3e478644d6637cc036ca4604547c4445d8623d991042bce8014e2",
      "status": "M"
    },
    {
      "kind": "REGULAR",
      "path": "tests/unit/test_engine_readiness_contract.py",
      "sha256": "ca356ae1d499933ae6f9f72c7fb117eacfedee64dffa7b9c2e5f725349b9a77d",
      "status": "M"
    },
    {
      "kind": "REGULAR",
      "path": "tests/unit/test_full_repository_coverage_batch2.py",
      "sha256": "d049c50ad53bf94aea5ee892e2f722078835a9ba2d189b68dc9332bb2ce5bb42",
      "status": "M"
    },
    {
      "kind": "REGULAR",
      "path": "tests/unit/test_full_repository_coverage_batch3.py",
      "sha256": "e28992536f81044fe287d2d64f93795ff053ac36cbb7dc67b1eadae52fc10218",
      "status": "M"
    },
    {
      "kind": "REGULAR",
      "path": "tests/unit/test_full_repository_coverage_batch6.py",
      "sha256": "d2db77bc424c76d09001849f3467c1066d455e6909c50aad42762906acb9b880",
      "status": "M"
    },
    {
      "kind": "REGULAR",
      "path": "tests/unit/test_full_repository_coverage_engine.py",
      "sha256": "a800d327899e7320bd328783b918a221803fead164e4649f357b7889a3427b97",
      "status": "M"
    },
    {
      "kind": "REGULAR",
      "path": "tests/unit/test_full_repository_coverage_engine_authority.py",
      "sha256": "a5ed865b98b4e42bf2eb3763949a2fb2fae295678f82fbac69278a5c7bc47af7",
      "status": "M"
    },
    {
      "kind": "REGULAR",
      "path": "tests/unit/test_full_repository_coverage_engine_deep.py",
      "sha256": "276cede575314d2375c865b468af7ce84364f1cd8993c1eecb69df593475d046",
      "status": "M"
    },
    {
      "kind": "REGULAR",
      "path": "tests/unit/test_full_repository_coverage_engine_initialization.py",
      "sha256": "59420a1f71818e72daa4d9823971e331fbd918518dbc0611ecf61b61f1f52053",
      "status": "M"
    },
    {
      "kind": "REGULAR",
      "path": "tests/unit/test_full_repository_coverage_engine_maintenance.py",
      "sha256": "f1431e4cd613bf78e60f068cde4fc1f3020b34dffe78b382e09b909232ce8794",
      "status": "M"
    },
    {
      "kind": "REGULAR",
      "path": "tests/unit/test_full_repository_coverage_engine_remaining.py",
      "sha256": "a5fe9eb5047026a3c395b2c6cd7bceb41af560dc409de7d24a875387c56c387f",
      "status": "M"
    },
    {
      "kind": "REGULAR",
      "path": "tests/unit/test_full_repository_coverage_engine_runtime.py",
      "sha256": "5963ed2b7309fde23c85d2029e29225e4065cb827d5350ac3f3f163efd225eb1",
      "status": "M"
    },
    {
      "kind": "REGULAR",
      "path": "tests/unit/test_full_repository_coverage_monitoring_edges.py",
      "sha256": "5101d70c44bc0e1f7b7b3d679f4c1a96c8a4ed53aa86839ea49456f2e061727e",
      "status": "M"
    },
    {
      "kind": "REGULAR",
      "path": "tests/unit/test_full_repository_coverage_remaining_batch.py",
      "sha256": "f5f361fb721809b34ca937b59fba8b5e0823008fc046d4061d1d6ed10ebbdfae",
      "status": "M"
    },
    {
      "kind": "REGULAR",
      "path": "tests/unit/test_full_repository_coverage_supervisor_remaining.py",
      "sha256": "985b4e40bbb4e663a8d272d9e4bbf104e5fe44c7dee839877041167540a45697",
      "status": "M"
    },
    {
      "kind": "REGULAR",
      "path": "tests/unit/test_g5_producer_runtime.py",
      "sha256": "4553d2116fa2700ba158938c277f459900f7bf0fd2a0fa007e8f702276269823",
      "status": "M"
    },
    {
      "kind": "REGULAR",
      "path": "tests/unit/test_g7_certification_integration.py",
      "sha256": "e05b578075b796239ebcf12768a68a75d7da25efdb53a9d397d40117cf38cff0",
      "status": "M"
    },
    {
      "kind": "REGULAR",
      "path": "tests/unit/test_launcher.py",
      "sha256": "8c2b74d234a1888246f510c471199c6c91e9152c7ee0a8e5243419c4089d9132",
      "status": "M"
    },
    {
      "kind": "REGULAR",
      "path": "tests/unit/test_locked_snapshot.py",